keyword,monthly_volume,difficulty,cpc_usd,serp_features,trend,content_format,cluster_topic,keyword_type,intent_subtype,location_scope
balayage vs highlights difference,2400,24,1.80,featured snippet|PAA,stable,comparison article,color-education,core,comparison,national
how often should you get balayage,1300,18,1.50,featured snippet|PAA,stable,FAQ page,color-education,core,how-to,national
what is a single process color,880,16,1.20,PAA,stable,what-is explainer,color-education,core,what-is,national
partial vs full balayage,880,19,1.50,PAA,stable,comparison article,color-education,core,comparison,national
foils vs balayage,720,22,1.60,PAA,stable,comparison article,color-education,core,comparison,national
single process vs double process color,320,15,1.30,PAA,stable,comparison article,color-education,core,comparison,national
what is a toner for hair,2900,21,0.90,featured snippet|PAA,stable,what-is explainer,color-education,core,what-is,national
how to make balayage last longer,1000,20,1.60,featured snippet|PAA,stable,how-to guide,balayage-care,core,how-to,national
balayage aftercare tips,720,15,1.40,PAA,stable,how-to guide,balayage-care,core,how-to,national
how to keep hair color from fading,1900,23,1.70,featured snippet|PAA,stable,how-to guide,balayage-care,core,how-to,national
how often should you get a haircut,6600,22,1.10,featured snippet|PAA,stable,FAQ page,haircut-basics,core,how-to,national
how long does a blowout last,1600,17,1.00,PAA,stable,FAQ page,styling-basics,core,how-to,national
deep conditioning treatment benefits,590,14,1.00,PAA,stable,listicle,hair-health,core,why,national
how much does balayage cost,5400,28,2.40,featured snippet|PAA,stable,what-is explainer,pricing-factors,core,what-is,national
how to choose a hair salon,720,20,2.20,PAA,stable,checklist,choosing-salon,core,how-to,national
booth rental vs commission salon,1000,22,3.50,PAA,rising,comparison article,booth-rental,adjacent,comparison,national
how much does salon booth rental cost,480,20,3.20,PAA,rising,what-is explainer,booth-rental,adjacent,what-is,national
how to become an independent hair stylist,390,19,2.80,PAA,rising,how-to guide,booth-rental,adjacent,how-to,national
winter hair care tips for dry hair,1300,21,1.20,PAA,seasonal,listicle,seasonal-care,adjacent,how-to,national
does hard water affect your hair,480,16,1.10,PAA,stable,what-is explainer,hair-health,adjacent,why,national
